{
  "arrays": [
    {
      "codec": "rgba8",
      "kind": "colour",
      "levels": 2,
      "pageSize": 512,
      "pxPerTile": 16
    },
    {
      "codec": "rgba8",
      "kind": "shadow",
      "levels": 1,
      "pageSize": 256,
      "pxPerTile": 8
    },
    {
      "codec": "rgba8",
      "kind": "light",
      "levels": 1,
      "pageSize": 128,
      "pxPerTile": 8
    },
    {
      "codec": "rgba8",
      "kind": "icon",
      "levels": 1,
      "pageSize": 128,
      "pxPerTile": 16
    }
  ],
  "axesVersion": 1,
  "dom": {
    "icons": {},
    "tech": {}
  },
  "frames": [
    [0, 0, 8, 8, 32, 40, 16, 24],
    [0, 0, 8, 8, 32, 16, 16, 24],
    [0, 0, 8, 40, 32, 8, 16, -8],
    [0, 0, 8, 24, 8, 16, 16, 8],
    [0, 0, 32, 24, 8, 16, -8, 8],
    [0, 0, 72, 8, 16, 16, 8, 8],
    [0, 0, 104, 8, 16, 16, 8, 8],
    [0, 0, 136, 8, 16, 16, 8, 8],
    [0, 0, 168, 8, 16, 16, 8, 8],
    [0, 0, 200, 8, 16, 16, 8, 8],
    [0, 0, 232, 8, 16, 16, 8, 8],
    [0, 0, 264, 8, 16, 16, 8, 8],
    [0, 0, 296, 8, 16, 16, 8, 8],
    [0, 0, 328, 8, 16, 16, 8, 8],
    [0, 0, 360, 8, 16, 16, 8, 8],
    [0, 0, 392, 8, 16, 16, 8, 8],
    [0, 0, 424, 8, 16, 16, 8, 8],
    [0, 0, 456, 8, 16, 16, 8, 8],
    [0, 0, 488, 8, 16, 16, 8, 8],
    [0, 0, 8, 72, 16, 16, 8, 8],
    [0, 0, 40, 72, 16, 16, 8, 8],
    [0, 0, 72, 72, 32, 40, 16, 24],
    [1, 0, 8, 8, 24, 16, 8, 8],
    [2, 0, 8, 8, 8, 8, 4, 4],
    [0, 0, 136, 72, 16, 16, 8, 8],
    [0, 0, 168, 72, 16, 16, 8, 8],
    [0, 0, 200, 72, 16, 16, 8, 8],
    [0, 0, 232, 72, 16, 16, 8, 8],
    [0, 0, 264, 72, 16, 16, 8, 8],
    [0, 0, 296, 72, 16, 16, 8, 8],
    [0, 0, 328, 72, 16, 16, 8, 8],
    [0, 0, 360, 72, 16, 16, 8, 8],
    [0, 0, 392, 72, 16, 16, 8, 8],
    [0, 0, 424, 72, 16, 16, 8, 8],
    [0, 0, 456, 72, 16, 16, 8, 8],
    [0, 0, 488, 72, 16, 16, 8, 8],
    [0, 0, 8, 136, 16, 16, 8, 8],
    [0, 0, 40, 136, 16, 16, 8, 8],
    [0, 0, 72, 136, 16, 16, 8, 8],
    [0, 0, 104, 136, 16, 16, 8, 8],
    [0, 0, 136, 136, 16, 16, 8, 8],
    [0, 0, 168, 136, 16, 16, 8, 8],
    [0, 0, 200, 136, 16, 16, 8, 8],
    [0, 0, 232, 136, 16, 16, 8, 8],
    [0, 0, 264, 136, 16, 16, 8, 8],
    [0, 0, 296, 136, 16, 16, 8, 8],
    [0, 0, 328, 136, 16, 16, 8, 8],
    [0, 0, 360, 136, 16, 16, 8, 8],
    [0, 0, 392, 136, 16, 16, 8, 8],
    [0, 0, 424, 136, 16, 16, 8, 8],
    [0, 0, 456, 136, 16, 16, 8, 8],
    [0, 0, 488, 136, 16, 16, 8, 8],
    [0, 0, 8, 168, 16, 16, 8, 8],
    [0, 0, 40, 168, 16, 16, 8, 8],
    [0, 0, 72, 168, 16, 16, 8, 8],
    [0, 0, 104, 168, 16, 16, 8, 8],
    [0, 0, 136, 168, 16, 16, 8, 8],
    [0, 0, 168, 168, 16, 16, 8, 8],
    [0, 0, 200, 168, 16, 16, 8, 8],
    [0, 0, 232, 168, 16, 16, 8, 8],
    [0, 0, 264, 168, 16, 16, 8, 8],
    [0, 0, 296, 168, 16, 16, 8, 8],
    [0, 0, 328, 168, 16, 16, 8, 8],
    [0, 0, 360, 168, 16, 16, 8, 8],
    [0, 0, 392, 168, 16, 16, 8, 8],
    [0, 0, 424, 168, 16, 16, 8, 8],
    [0, 0, 456, 168, 16, 16, 8, 8],
    [0, 0, 488, 168, 16, 16, 8, 8],
    [0, 0, 8, 200, 16, 16, 8, 8],
    [0, 0, 40, 200, 16, 16, 8, 8],
    [0, 0, 72, 200, 16, 16, 8, 8],
    [0, 0, 104, 200, 16, 16, 8, 8],
    [0, 0, 136, 200, 16, 16, 8, 8],
    [0, 0, 168, 200, 16, 16, 8, 8],
    [0, 0, 200, 200, 16, 16, 8, 8],
    [0, 0, 232, 200, 16, 16, 8, 8],
    [0, 0, 264, 200, 16, 16, 8, 8],
    [0, 0, 296, 200, 16, 16, 8, 8],
    [0, 0, 328, 200, 16, 16, 8, 8],
    [0, 0, 360, 200, 16, 16, 8, 8],
    [0, 0, 392, 200, 16, 16, 8, 8],
    [0, 0, 424, 200, 16, 16, 8, 8],
    [0, 0, 456, 200, 16, 16, 8, 8],
    [0, 0, 488, 200, 16, 16, 8, 8],
    [0, 0, 8, 232, 16, 16, 8, 8],
    [0, 0, 40, 232, 16, 16, 8, 8],
    [0, 0, 72, 232, 16, 16, 8, 8],
    [0, 0, 104, 232, 16, 16, 8, 8],
    [1, 0, 72, 8, 8, 8, 4, 4],
    [1, 0, 104, 8, 8, 8, 4, 4],
    [1, 0, 136, 8, 8, 8, 4, 4],
    [1, 0, 168, 8, 8, 8, 4, 4],
    [0, 0, 136, 232, 4, 16, 2, 14],
    [1, 0, 200, 8, 4, 8, 2, 7],
    [0, 0, 168, 232, 14, 12, 7, 9],
    [1, 0, 232, 8, 4, 4, 2, 3],
    [0, 0, 200, 232, 14, 12, 7, 9],
    [1, 0, 8, 40, 4, 4, 2, 3],
    [1, 0, 40, 40, 8, 4, 2, 2],
    [0, 0, 232, 232, 16, 16, 8, 14],
    [0, 0, 264, 232, 16, 16, 8, 14],
    [0, 0, 296, 232, 16, 16, 8, 14],
    [0, 0, 328, 232, 16, 16, 8, 14],
    [1, 0, 72, 40, 8, 4, 2, 2],
    [0, 0, 360, 232, 16, 16, 8, 14],
    [0, 0, 392, 232, 16, 16, 8, 14],
    [0, 0, 424, 232, 16, 16, 8, 14],
    [0, 0, 456, 232, 16, 16, 8, 14],
    [1, 0, 104, 40, 8, 4, 2, 2],
    [0, 0, 488, 232, 16, 16, 8, 14],
    [0, 0, 8, 264, 16, 16, 8, 14],
    [0, 0, 40, 264, 16, 16, 8, 14],
    [0, 0, 72, 264, 16, 16, 8, 14],
    [1, 0, 136, 40, 8, 4, 2, 2],
    [0, 0, 104, 264, 16, 16, 8, 14],
    [0, 0, 136, 264, 16, 16, 8, 14],
    [0, 0, 168, 264, 16, 16, 8, 14],
    [0, 0, 200, 264, 16, 16, 8, 14],
    [1, 0, 168, 40, 8, 4, 2, 2],
    [0, 0, 232, 264, 16, 16, 8, 14],
    [0, 0, 264, 264, 16, 16, 8, 14],
    [0, 0, 296, 264, 16, 16, 8, 14],
    [0, 0, 328, 264, 16, 16, 8, 14],
    [1, 0, 200, 40, 8, 4, 2, 2],
    [0, 0, 360, 264, 16, 16, 8, 14],
    [0, 0, 392, 264, 16, 16, 8, 14],
    [0, 0, 424, 264, 16, 16, 8, 14],
    [0, 0, 456, 264, 16, 16, 8, 14],
    [1, 0, 232, 40, 8, 4, 2, 2],
    [0, 0, 488, 264, 16, 16, 8, 14],
    [0, 0, 8, 296, 16, 16, 8, 14],
    [0, 0, 40, 296, 16, 16, 8, 14],
    [0, 0, 72, 296, 16, 16, 8, 14],
    [1, 0, 8, 72, 8, 4, 2, 2],
    [0, 0, 104, 296, 16, 16, 8, 14],
    [0, 0, 136, 296, 16, 16, 8, 14],
    [0, 0, 168, 296, 16, 16, 8, 14],
    [0, 0, 200, 296, 16, 16, 8, 14],
    [1, 0, 40, 72, 8, 4, 2, 2],
    [0, 0, 232, 296, 16, 16, 8, 14],
    [0, 0, 264, 296, 16, 16, 8, 14],
    [0, 0, 296, 296, 16, 16, 8, 14],
    [0, 0, 328, 296, 16, 16, 8, 14],
    [0, 0, 360, 296, 16, 16, 8, 14],
    [0, 0, 392, 296, 16, 16, 8, 14],
    [0, 0, 424, 296, 16, 16, 8, 14],
    [0, 0, 456, 296, 16, 16, 8, 14],
    [0, 0, 488, 296, 16, 16, 8, 14],
    [0, 0, 8, 328, 16, 16, 8, 14],
    [0, 0, 40, 328, 16, 16, 8, 14],
    [0, 0, 72, 328, 16, 16, 8, 14],
    [0, 0, 104, 328, 16, 16, 8, 14],
    [0, 0, 136, 328, 16, 16, 8, 14],
    [0, 0, 168, 328, 16, 16, 8, 14],
    [0, 0, 200, 328, 16, 16, 8, 14],
    [1, 0, 72, 72, 8, 4, 2, 2],
    [0, 0, 232, 328, 16, 16, 8, 14],
    [0, 0, 264, 328, 16, 16, 8, 14],
    [0, 0, 296, 328, 16, 16, 8, 14],
    [0, 0, 328, 328, 16, 16, 8, 14],
    [0, 0, 360, 328, 16, 16, 8, 14],
    [0, 0, 392, 328, 16, 16, 8, 14],
    [0, 0, 424, 328, 16, 16, 8, 14],
    [0, 0, 456, 328, 16, 16, 8, 14],
    [0, 0, 488, 328, 16, 16, 8, 14],
    [0, 0, 8, 360, 16, 16, 8, 14],
    [0, 0, 40, 360, 16, 16, 8, 14],
    [0, 0, 72, 360, 16, 16, 8, 14],
    [0, 0, 104, 360, 16, 16, 8, 14],
    [0, 0, 136, 360, 16, 16, 8, 14],
    [0, 0, 168, 360, 16, 16, 8, 14],
    [0, 0, 200, 360, 16, 16, 8, 14],
    [1, 0, 104, 72, 8, 4, 2, 2],
    [0, 0, 232, 360, 16, 16, 8, 14],
    [0, 0, 264, 360, 16, 16, 8, 14],
    [0, 0, 296, 360, 16, 16, 8, 14],
    [0, 0, 328, 360, 16, 16, 8, 14],
    [0, 0, 360, 360, 16, 16, 8, 14],
    [0, 0, 392, 360, 16, 16, 8, 14],
    [0, 0, 424, 360, 16, 16, 8, 14],
    [0, 0, 456, 360, 16, 16, 8, 14],
    [0, 0, 488, 360, 16, 16, 8, 14],
    [0, 0, 8, 392, 16, 16, 8, 14],
    [0, 0, 40, 392, 16, 16, 8, 14],
    [0, 0, 72, 392, 16, 16, 8, 14],
    [0, 0, 104, 392, 16, 16, 8, 14],
    [0, 0, 136, 392, 16, 16, 8, 14],
    [0, 0, 168, 392, 16, 16, 8, 14],
    [0, 0, 200, 392, 16, 16, 8, 14],
    [1, 0, 136, 72, 8, 4, 2, 2],
    [0, 0, 232, 392, 16, 16, 8, 14],
    [0, 0, 264, 392, 16, 16, 8, 14],
    [0, 0, 296, 392, 16, 16, 8, 14],
    [0, 0, 328, 392, 16, 16, 8, 14],
    [0, 0, 360, 392, 16, 16, 8, 14],
    [0, 0, 392, 392, 16, 16, 8, 14],
    [0, 0, 424, 392, 16, 16, 8, 14],
    [0, 0, 456, 392, 16, 16, 8, 14],
    [0, 0, 488, 392, 16, 16, 8, 14],
    [0, 0, 8, 424, 16, 16, 8, 14],
    [0, 0, 40, 424, 16, 16, 8, 14],
    [0, 0, 72, 424, 16, 16, 8, 14],
    [0, 0, 104, 424, 16, 16, 8, 14],
    [0, 0, 136, 424, 16, 16, 8, 14],
    [0, 0, 168, 424, 16, 16, 8, 14],
    [0, 0, 200, 424, 16, 16, 8, 14],
    [1, 0, 168, 72, 8, 4, 2, 2],
    [0, 0, 232, 424, 16, 16, 8, 14],
    [0, 0, 264, 424, 16, 16, 8, 14],
    [0, 0, 296, 424, 16, 16, 8, 14],
    [0, 0, 328, 424, 16, 16, 8, 14],
    [0, 0, 360, 424, 16, 16, 8, 14],
    [0, 0, 392, 424, 16, 16, 8, 14],
    [0, 0, 424, 424, 16, 16, 8, 14],
    [0, 0, 456, 424, 16, 16, 8, 14],
    [0, 0, 488, 424, 16, 16, 8, 14],
    [0, 0, 8, 456, 16, 16, 8, 14],
    [0, 0, 40, 456, 16, 16, 8, 14],
    [0, 0, 72, 456, 16, 16, 8, 14],
    [0, 0, 104, 456, 16, 16, 8, 14],
    [0, 0, 136, 456, 16, 16, 8, 14],
    [0, 0, 168, 456, 16, 16, 8, 14],
    [0, 0, 200, 456, 16, 16, 8, 14],
    [1, 0, 200, 72, 8, 4, 2, 2],
    [0, 0, 232, 456, 16, 16, 8, 14],
    [0, 0, 264, 456, 16, 16, 8, 14],
    [0, 0, 296, 456, 16, 16, 8, 14],
    [0, 0, 328, 456, 16, 16, 8, 14],
    [0, 0, 360, 456, 16, 16, 8, 14],
    [0, 0, 392, 456, 16, 16, 8, 14],
    [0, 0, 424, 456, 16, 16, 8, 14],
    [0, 0, 456, 456, 16, 16, 8, 14],
    [0, 0, 488, 456, 16, 16, 8, 14],
    [0, 0, 8, 488, 16, 16, 8, 14],
    [0, 0, 40, 488, 16, 16, 8, 14],
    [0, 0, 72, 488, 16, 16, 8, 14],
    [0, 0, 104, 488, 16, 16, 8, 14],
    [0, 0, 136, 488, 16, 16, 8, 14],
    [0, 0, 168, 488, 16, 16, 8, 14],
    [0, 0, 200, 488, 16, 16, 8, 14],
    [1, 0, 232, 72, 8, 4, 2, 2],
    [0, 0, 232, 488, 16, 16, 8, 14],
    [0, 0, 264, 488, 16, 16, 8, 14],
    [0, 0, 296, 488, 16, 16, 8, 14],
    [0, 0, 328, 488, 16, 16, 8, 14],
    [0, 0, 360, 488, 16, 16, 8, 14],
    [0, 0, 392, 488, 16, 16, 8, 14],
    [0, 0, 424, 488, 16, 16, 8, 14],
    [0, 0, 456, 488, 16, 16, 8, 14],
    [0, 0, 488, 488, 16, 16, 8, 14],
    [0, 1, 8, 8, 16, 16, 8, 14],
    [0, 1, 40, 8, 16, 16, 8, 14],
    [0, 1, 72, 8, 16, 16, 8, 14],
    [0, 1, 104, 8, 16, 16, 8, 14],
    [0, 1, 136, 8, 16, 16, 8, 14],
    [0, 1, 168, 8, 16, 16, 8, 14],
    [0, 1, 200, 8, 16, 16, 8, 14],
    [1, 0, 8, 104, 8, 4, 2, 2],
    [0, 1, 232, 8, 16, 16, 8, 14],
    [0, 1, 264, 8, 16, 16, 8, 14],
    [0, 1, 296, 8, 16, 16, 8, 14],
    [0, 1, 328, 8, 16, 16, 8, 14],
    [0, 1, 360, 8, 16, 16, 8, 14],